76|Assim que apareceu, senti-me livre do inimigo que me sujeitava. Quando a luz pousou sobre mim, vi dois Personagens cujo esplendor e glória desafiam qualquer descrição, pairando no ar, acima de mim. Um deles falou-me, chamando-me pelo nome, e disse, apontando para o outro: Este é Meu Filho Amado. Ouve-O!
76|Meu objetivo ao dirigir-me ao Senhor era saber qual de todas as seitas estava certa, a fim de saber a qual me unir. Portanto, tão logo me controlei o suficiente para poder falar, perguntei aos Personagens que estavam na luz acima de mim qual de todas as seitas estava certa (pois até aquele momento jamais me ocorrera que todas estivessem erradas) e a qual me unir.
76|Foi-me respondido que não me unisse a qualquer delas, pois estavam todas erradas; e o Personagem que se dirigia a mim disse que todos os seus credos eram uma abominação a sua vista; que aqueles religiosos eram todos corruptos; que “eles se aproximam de mim com os lábios, mas seu coração está longe de mim; ensinam como doutrina os mandamentos de homens, tendo aparência de religiosidade, mas negam o seu poder.”
76|Novamente me proibiu de unir-me a qualquer delas; e muitas outras coisas disse-me, as quais não posso, no momento, escrever. Quando tornei a voltar a mim, estava deitado de costas, olhando para o céu. Quando a luz se retirou, eu estava sem forças; mas tendo logo me recuperado em parte, fui para casa. Ao apoiar-me na lareira, minha mãe perguntou-me o que se passava. Respondi: “Não se preocupe, tudo está bem — eu estou bem.” Então disse a ela: “Aprendi por mim mesmo que o presbiterianismo não é verdadeiro.” Parece que o adversário sabia, nos primeiros anos de minha vida, que eu estava destinado a ser um perturbador e um importunador de seu reino; senão, por que os poderes das trevas se uniriam contra mim? Por que a oposição e a perseguição que se levantaram contra mim, quase em minha infância?
77|E o anjo lhes disse: Não temais, porque eis aqui vos trago novas de grande alegria, que será para todo o povo.
77|Pois hoje, na cidade de Davi, vos nasceu o Salvador, que é Cristo, o Senhor.
77|E isto vos será por sinal: Achareis o menino envolto em panos, e deitado numa manjedoura.
78|E tomando o pão, e havendo dado graças, partiu-o, e deu-lho, dizendo: Isto é o meu corpo, que por vós é dado; fazei isto em memória de mim.
78|Semelhantemente tomou o cálice, depois da ceia, dizendo: Este cálice é o novo testamento no meu sangue, que é derramado por vós.
79|E falando eles dessas coisas, o próprio Jesus se apresentou no meio deles, e disse-lhes: Paz seja convosco.
79|E eles, espantados e atemorizados, pensavam que viam algum espírito.
79|E ele lhes disse: Por que estais perturbados, e por que sobem tais pensamentos ao vosso coração?
79|Vede as minhas mãos e os meus pés, que sou eu mesmo; apalpai-me e vede, pois um espírito não tem carne nem ossos, como vedes que eu tenho.
80|Roubará o homem a Deus? Porque vós me roubais, e dizeis: Em que te roubamos? Nos dízimos e nas ofertas.
80|Com maldição sois amaldiçoados, porque me roubais a mim, sim, toda a nação.
80|Trazei todos os dízimos à casa do tesouro, para que haja mantimento na minha casa, e provai-me nisto, diz o Senhor dos Exércitos, se eu não vos abrir as janelas do céu, e não derramar sobre vós uma bênção tal, até que não haja mais lugar para a recolherdes.
81|Eis que eu vos envio o profeta Elias, antes que venha o grande e terrível dia do Senhor;
81|E ele converterá o coração dos pais aos filhos, e o coração dos filhos a seus pais; para que eu não venha, e fira a terra com maldição.
82|Vós sois a luz do mundo; não se pode esconder uma cidade edificada sobre um monte,
82|Nem se acende a candeia e se coloca debaixo do alqueire, mas no velador, e dá luz a todos que estão na casa.
82|Assim resplandeça a vossa luz diante dos homens, para que vejam as vossas boas obras, e glorifiquem a vosso Pai, que está nos céus.
83|Vinde a mim, todos os que estais cansados e oprimidos, e eu vos aliviarei.
83|Tomai sobre vós o meu jugo, e aprendei de mim, que sou manso e humilde de coração; e encontrareis descanso para a vossa alma.
83|Porque o meu jugo é suave, e o meu fardo é leve.
84|Disse-lhes ele: E vós, quem dizeis vós que eu sou?
84|E Simão Pedro, respondendo, disse: Tu és o Cristo, o Filho do Deus vivo.
84|E Jesus, respondendo, disse-lhe: Bem-aventurado és tu, Simão Barjonas, porque to não revelou a carne e o sangue, mas meu Pai, que está nos céus.
84|E também eu te digo que tu és Pedro, e sobre esta pedra edificarei a minha igreja, e as portas do inferno não prevalecerão contra ela.
84|E eu te darei as chaves do reino dos céus; e tudo o que ligares na terra será ligado nos céus, e tudo o que desligares na terra será desligado nos céus.
85|Mestre, qual é o grande mandamento na lei?
85|E Jesus disse-lhe: Amarás ao Senhor teu Deus de todo o teu coração, e de toda a tua alma, e de todo o teu pensamento.
85|Este é o primeiro e grande mandamento.
85|E o segundo, semelhante a este, é: Amarás o teu próximo como a ti mesmo.
86|Pois eis que esta é minha obra e minha glória: Levar a efeito a imortalidade e vida eterna do homem.
87|E o Senhor chamou seu povo Sião, porque eram unos de coração e vontade e viviam em retidão; e não havia pobres entre eles.
88|E a caridade é sofredora e é benigna e não é invejosa e não se ensoberbece; não busca seus interesses, não se irrita facilmente, não suspeita mal e não se regozija com a iniquidade, mas regozija-se com a verdade; tudo sofre, tudo crê, tudo espera, tudo suporta.
88|De modo que, meus amados irmãos, se não tendes caridade, nada sois, porque a caridade nunca falha. Portanto, apegai-vos à caridade, que é, de todas, a maior, porque todas as coisas hão de falhar —
88|Mas a caridade é o puro amor de Cristo e permanece para sempre; e para todos os que a possuírem, no último dia tudo estará bem.
88|Portanto, meus amados irmãos, rogai ao Pai, com toda a energia de vosso coração, que sejais cheios desse amor que ele concedeu a todos os que são verdadeiros seguidores de seu Filho, Jesus Cristo; que vos torneis os filhos de Deus; que quando ele aparecer, sejamos como ele, porque o veremos como ele é; que tenhamos esta esperança; que sejamos purificados, como ele é puro. Amém.
89|E quando receberdes estas coisas, eu vos exorto a perguntardes a Deus, o Pai Eterno, em nome de Cristo, se estas coisas não são verdadeiras; e se perguntardes com um coração sincero e com real intenção, tendo fé em Cristo, ele vos manifestará a verdade delas pelo poder do Espírito Santo.
89|E pelo poder do Espírito Santo podeis saber a verdade de todas as coisas.
90|E eis que vos digo estas coisas para que aprendais sabedoria; para que saibais que, quando estais a serviço de vosso próximo, estais somente a serviço de vosso Deus.
91|E ainda mais, quisera que considerásseis o estado abençoado e feliz daqueles que guardam os mandamentos de Deus. Pois eis que são abençoados em todas as coisas, tanto materiais como espirituais; e se eles se conservarem fiéis até o fim, serão recebidos no céu, para que assim possam habitar com Deus em um estado de felicidade sem fim. Oh! Lembrai-vos, lembrai-vos de que estas coisas são verdadeiras, porque o Senhor Deus as disse.
92|Porque o homem natural é inimigo de Deus e tem-no sido desde a queda de Adão e sê-lo-á para sempre; a não ser que ceda ao influxo do Santo Espírito e despoje-se do homem natural e torne-se santo pela expiação de Cristo, o Senhor; e torne-se como uma criança, submisso, manso, humilde, paciente, cheio de amor, disposto a submeter-se a tudo quanto o Senhor achar que lhe deva infligir, assim como uma criança se submete a seu pai.
93|Acreditai em Deus; acreditai que ele existe e que criou todas as coisas, tanto no céu como na Terra; acreditai que ele tem toda a sabedoria e todo o poder, tanto no céu como na Terra; acreditai que o homem não compreende todas as coisas que o Senhor pode compreender.
94|E aconteceu que ele lhes disse: Eis aqui as águas de Mórmon (pois assim eram chamadas); e agora, sendo que desejais entrar no rebanho de Deus e ser chamados seu povo; e sendo que estais dispostos a carregar os fardos uns dos outros, para que fiquem leves;
94|Sim, e estais dispostos a chorar com os que choram; sim, e consolar os que necessitam de consolo e servir de testemunhas de Deus em todos os momentos e em todas as coisas e em todos os lugares em que vos encontreis, mesmo até a morte; para que sejais redimidos por Deus e contados com os da primeira ressurreição, para que tenhais a vida eterna —
94|Agora vos digo que, se for esse o desejo de vosso coração, o que vos impede de serdes batizados em nome do Senhor, como um testemunho, perante ele, de que haveis feito convênio com ele de servi-lo e guardar seus mandamentos, para que ele possa derramar seu Espírito com mais abundância sobre vós?
95|Confia no Senhor de todo o teu coração, e não te estribes no teu próprio entendimento.
95|Reconhece-o em todos os teus caminhos, e ele endireitará as tuas veredas.
96|Quem subirá ao monte do Senhor, ou quem estará no seu lugar santo?
96|Aquele que é limpo de mãos e puro de coração, que não entrega a sua alma à vaidade, nem jura enganosamente.
97|E se algum de vós tem falta de sabedoria, peça-a a Deus, que a todos dá liberalmente, sem repreensão, e ser-lhe-á dada.
97|Porém peça-a com fé, não duvidando; porque o que duvida é semelhante à onda do mar, que é levada pelo vento, e lançada de uma para outra parte.
98|Assim também a fé, se não tiver as obras, está morta em si mesma.
98|Porém dirá alguém: Tu tens a fé, e eu tenho as obras; mostra-me a tua fé sem as tuas obras, e eu te mostrarei a minha fé pelas minhas obras.
